{
  "schema_version": "1",
  "generated_at": "2026-09-07T23:40:00+00:00",
  "council": {
    "name": "Norwich City Council",
    "slug": "norwich-city-council",
    "website": "https://www.norwich.gov.uk",
    "tier": "district",
    "remit_note": "Norwich City Council is a district council with city status. In Norfolk, local government is split between two councils, and Norwich does the half you meet day to day: the council housing it owns and manages itself, bin collections, parks, planning applications, and licensing — who may sell alcohol, put on entertainment, or serve hot food and drink late at night. Roads and potholes, schools and libraries, and social care for children and adults belong to Norfolk County Council instead, so you will not find those here.",
    "platforms": {
      "committees": "cmis",
      "website": "localgov_drupal",
      "consultations": "engagement"
    }
  },
  "topic": {
    "name": "Housing allocations",
    "slug": "housing-allocations",
    "plain_english": "The rules Norwich City Council follows when it decides who can join the waiting list for a council or housing association home in the city, and who gets offered one first. The scheme is called Home Options. It does not produce any more homes — in the council's words, it is “a fairer, more efficient and transparent way of allocating the social housing available”.",
    "questions": {
      "asked": "People were asked what they thought of five changes to who can join Norwich's housing register and who is offered a home first: telling applicants with no priority band that they are unlikely to be rehoused and pointing them elsewhere; raising the local connection rule from six months' residence in Norwich to two years; cutting the number of offers you may refuse from five to three; setting out when someone sleeping rough is given silver band; and offering a home to a UK armed forces veteran ahead of others in the same band. Seventy-two responses came in. Agreement ran from 71 per cent on the first change down to 37 per cent on veterans' priority, which 43 per cent were neutral about; the local connection change was the one most people objected to, at 26 per cent against.",
      "decided": "Two meetings. On 15 January 2026 the Scrutiny committee suggested no changes to the five proposals, then by a majority vote asked Cabinet to consider deleting a sixth thing nobody had proposed changing: paragraph 3.8.7.3, which withholds extra priority from families in a flat with no garden where the children were born after the family moved in. On 11 February 2026 Cabinet adopted the updated policy with all five changes, and refused the Scrutiny request — the report says it “has been considered by the Portfolio Holder but is not accepted”. Cabinet did record one change made because of the consultation: a needs-led assessment before someone sleeping rough is given silver band.",
      "done": "This one is finished. The Home Options Allocation Scheme 2026 was published on 12 February 2026, the day after Cabinet agreed it, and it is the scheme the council applies now — its own page for applicants states the two-year residence rule the new scheme introduced. What we cannot tell you is what it has changed in practice. The council said the consultation responses “will be published, along with council comments, in an online report” and we could not find that report, and nothing published says how many applicants the two-year rule has kept off the register. On effect, we are still waiting."
    }
  },
  "sources": [
    {
      "id": "housing-consultation-home-options",
      "title": "Homelessness Strategy and Housing Allocations Policy — consultation (Get Talking Norwich)",
      "type": "consultation",
      "stage": "feedback",
      "body": null,
      "platform": "engagement",
      "source_url": "https://gettalking.norwich.gov.uk/homelessnessandallocations",
      "fetched_at": "2026-09-07T19:40:40+00:00",
      "sha256": "5a3bf05c74b36be276976d691ad69f540599ef9a462ab46c7b70454d6c9e3c3b",
      "saved_to": "data/raw/housing-consultation-home-options/page.html",
      "summary": "The council's consultation page on Get Talking Norwich, covering two policies at once: a new homelessness strategy and the Home Options rules for allocating council homes. It says the consultation was open “from Monday 10 November 2025 to Sunday 7 December 2025”, and offers a draft policy, a briefing note and an equality impact assessment to read before answering the survey. Since it closed the council has added a “you said, we did” update naming what it changed in the allocations proposal because of what people said. The page also gives two round numbers for housing pressure in Norwich — around 4,000 people waiting for social housing and over 1,200 enquiries a month — without saying when either was counted.",
      "ai": {
        "source_ids": [
          "housing-consultation-home-options"
        ],
        "prompt_version": "summarise-v1",
        "model": "claude-opus-5 (agent session)",
        "confidence": "high",
        "review_status": "needs_review",
        "reviewed_by": null,
        "generated_at": "2026-09-07T23:40:00+00:00",
        "cache_key": "9f2e224b59c3d19bad1d5ee35326c62aea3abf92ebed110fb19624c1d5618966"
      }
    },
    {
      "id": "housing-consultation-home-options--allocations-policy-2025-consultation-draft",
      "title": "Allocations policy 2025 - consultation draft",
      "type": "consultation",
      "stage": "feedback",
      "body": null,
      "platform": "engagement",
      "source_url": "https://gettalking.norwich.gov.uk/42605/widgets/135103/documents/94939/download",
      "fetched_at": "2026-09-07T19:40:41+00:00",
      "sha256": "e6b4c95916a39da433f8b55f6a0e5631783c1ce06b90950984a8fe4de97a4935",
      "saved_to": "data/raw/housing-consultation-home-options/allocations-policy-2025-consultation-draft.docx",
      "summary": "The full draft allocations scheme as residents saw it during the consultation, about 84,000 characters of it. Its value is as a before-and-after: read against the scheme the council adopted three months later, it shows which wording the consultation actually moved. The phrases “needs-led” and “professional judgement” appear nowhere in this draft and twice in the adopted scheme, and this draft gives extra preference to “a person fleeing violence” with rent arrears where the adopted scheme says “fleeing violence or domestic abuse”.",
      "ai": {
        "source_ids": [
          "housing-consultation-home-options--allocations-policy-2025-consultation-draft"
        ],
        "prompt_version": "summarise-v1",
        "model": "claude-opus-5 (agent session)",
        "confidence": "medium",
        "review_status": "needs_review",
        "reviewed_by": null,
        "generated_at": "2026-09-07T23:40:00+00:00",
        "cache_key": "d2cdd02815ab36365f7c1476e93a379160200c5abefa4cf2d7d53b7365bacb1a"
      }
    },
    {
      "id": "housing-consultation-home-options--allocations-policy-2025-briefing-note",
      "title": "Allocations Policy 2025 – Briefing Note",
      "type": "consultation",
      "stage": "feedback",
      "body": null,
      "platform": "engagement",
      "source_url": "https://gettalking.norwich.gov.uk/42605/widgets/135103/documents/94937/download",
      "fetched_at": "2026-09-07T19:40:42+00:00",
      "sha256": "92c79cff67b2bf763834ee70b793d23ee00007da64804bd45b42961a299c1120",
      "saved_to": "data/raw/housing-consultation-home-options/allocations-policy-2025-briefing-note.docx",
      "summary": "The council's plain-English summary of what it was proposing, and the shortest answer to “what were people actually asked?” It sets out the legal background — Part VI of the Housing Act requires every council to publish a scheme setting out who qualifies for social housing and in what order — says the current scheme dates from October 2021, then lists three key changes (two years' residence in Norwich instead of six months, three permitted refusals instead of five, and armed forces veterans offered a home first within their band) and eight smaller clarifications, including the one on rough sleeping.",
      "ai": {
        "source_ids": [
          "housing-consultation-home-options--allocations-policy-2025-briefing-note"
        ],
        "prompt_version": "summarise-v1",
        "model": "claude-opus-5 (agent session)",
        "confidence": "high",
        "review_status": "needs_review",
        "reviewed_by": null,
        "generated_at": "2026-09-07T23:40:00+00:00",
        "cache_key": "f0889a2859972959b2a4620dea37843fdb988a03c4fe55b0d9591e5b517b7f9c"
      }
    },
    {
      "id": "housing-consultation-home-options--allocations-policy-2025-equality-impact-assessment",
      "title": "Allocations Policy 2025 – Equality Impact Assessment",
      "type": "consultation",
      "stage": "feedback",
      "body": null,
      "platform": "engagement",
      "source_url": "https://gettalking.norwich.gov.uk/42605/widgets/135103/documents/94938/download",
      "fetched_at": "2026-09-07T19:40:43+00:00",
      "sha256": "968963867584189c6ee9eedea8e67383a8f00e76944372a3ac8aef2d5457ef5e",
      "saved_to": "data/raw/housing-consultation-home-options/allocations-policy-2025-equality-impact-assessment.docx",
      "summary": "The council's own assessment of who the changes would affect, completed on 4 November 2025 — before the consultation opened. It singles out three changes for assessment: the local connection requirement, the cut in permitted refusals, and veterans' priority. It records that the council owned 14,211 properties in October 2025, and it identifies an adverse impact on refugees leaving asylum accommodation, whose application process it says “typically lasts significantly less than the two years required to qualify for the housing register”. It assesses the proposed policy, not the version Cabinet went on to amend.",
      "ai": {
        "source_ids": [